{
  "adapterProfileVersion": "1.0.0",
  "adapterId": "sample-compliance-adapter-us-prod",
  "providerType": "Compliance",
  "hostingModel": "ImplementerHosted",
  "certificationTier": "Conformant",
  "status": "Active",
  "endpointBaseUrl": "https://verifier.example/v1/compliance/verify",
  "profilesSupported": [
    "US_VERIFICATION_BALANCED_V1",
    "US_VERIFICATION_STRICT_V1"
  ],
  "securityCapabilities": {
    "signedRequests": true,
    "signedResponses": true,
    "replayProtection": true,
    "auditTrail": true,
    "clockSkewSeconds": 30
  },
  "selfAttestation": {
    "attestedBy": "Adapter Security Team",
    "attestorRole": "SecurityOfficer",
    "payload": {
      "adapterId": "sample-compliance-adapter-us-prod",
      "providerType": "Compliance",
      "hostingModel": "ImplementerHosted",
      "profilesSupported": [
        "US_VERIFICATION_BALANCED_V1",
        "US_VERIFICATION_STRICT_V1"
      ],
      "securityCapabilities": {
        "signedRequests": true,
        "signedResponses": true,
        "replayProtection": true,
        "auditTrail": true,
        "clockSkewSeconds": 30
      }
    },
    "payloadDigestSha256": "sha256:61644ef23c3521f8b7f6f9c00dc701fca5c18b57cd58a25c51f8ce7f498b348e",
    "alg": "HMAC_SHA256",
    "kid": "faxp-lab-selfattest-2026q1",
    "sig": "4c2e312ebed3e2e51f596f19cdd24147934732a3b23948212edbedc5c621d39c",
    "signedAt": "2026-03-06T17:25:30Z",
    "expiresAt": "2026-09-02T17:25:30Z"
  }
}
